,Title,Location,Security,Garage,Concierge,Price,City,Currency,Nmbr_rooms,Nmbr_pieces,Nmbr_bathrooms,Type,Surface
0,Appartement de luxe en Vente Haut Agdal,Haut Agdal ,0,0,0,4207500.0,Rabat,DH,3,6,3,Bon état,255
1,Appartement à vendre au RDC,Agdal ,0,0,0,3900000.0,Rabat,DH,3,6,2,Bon état,196
2,"Appartement de 99m² avec terrasse en vente, Résidence Aicha",Kébibat ,0,0,0,,Rabat,,2,3,2,Bon état,99
3,Vente Appartement Rabat Hay Riad,Riyad ,0,0,0,2500000.0,Rabat,DH,3,5,1,Bon état,130
4,Penthouse à vendre à L'orangeraie Souissi 340m2,Souissi ,0,0,0,6500000.0,Rabat,DH,4,5,3,Bon état,340
5,Appartement de 152 m² à Rabat Square,Souissi ,0,0,0,4102000.0,Rabat,DH,2,2,2,Nouveau,152
7,Jolie villa à cote palais imarati,Souissi ,0,0,0,11000000.0,Rabat,DH,6,9,6,Bon état,2000
8,Ancienne villa à côté avenue Al Melia prix choc,Souissi ,0,0,0,11000000.0,Rabat,DH,5,8,4,À rénover,2200
9,Votre villa de luxe a rabat,Hay El Menzah ,0,0,0,5700000.0,Rabat,DH,3,4,2,Nouveau,560
10,Superbe appartement à vendre à Agdal. 4 chambres. Ascenseur,Agdal ,0,0,0,3800000.0,Rabat,DH,4,5,2,À rénover,200
11,Appartement de 95 m² en vente à Rabat Square,Souissi ,0,0,0,2836000.0,Rabat,DH,1,2,2,Nouveau,80
12,Riad à vendre vue panoramique,Médina ,0,0,0,6750000.0,Rabat,DH,3,8,3,Nouveau,744
13,Vente Appartement Rabat Hay Riad,Riyad ,0,0,0,4700000.0,Rabat,DH,3,6,1,Bon état,236
14,Appartement de 68 m² à Rabat Square,Souissi ,0,0,0,1872000.0,Rabat,DH,1,1,1,Nouveau,68
15,Bel appartement avenue nakhil,Riyad ,0,0,0,3000000.0,Rabat,DH,3,6,4,Nouveau,149
16,Un très joli appartement à agdal avenue ibn sina,Agdal ,0,0,0,3400000.0,Rabat,DH,4,6,2,Bon état,200
17,Appartement de 84 m² à Rabat Square,Souissi ,0,0,0,1939000.0,Rabat,DH,1,1,2,Nouveau,84
18,Charmante villa à hay riad,Riyad ,0,0,0,8800000.0,Rabat,DH,5,7,4,Bon état,909
20,Appartement de 130 m² à Rabat Square,Souissi ,0,0,0,3156000.0,Rabat,DH,2,2,2,Nouveau,130
23,"Appartement de 140m² avec terrasse en vente, Résidence Aicha",Kébibat ,0,0,0,,Rabat,,3,4,2,Bon état,140
24,Appartement retapé pour investissement,Hassan - Centre Ville ,0,0,0,1050000.0,Rabat,DH,1,2,1,Nouveau,70
26,Appartement de 131 m2 à Hay Riad,Riyad ,0,0,0,,Rabat,,2,3,2,Bon état,131
27,Appartement retapé à neuf avec 3 façades,Riyad ,0,0,0,3600000.0,Rabat,DH,3,5,2,Nouveau,187
29,Jolie villa à vendre située à OLM Souissi Rabat,Souissi ,0,0,0,7600000.0,Rabat,DH,4,6,4,Bon état,700
31,Bel appartement à vendre situé à Hay riad Rabat,Riyad ,0,0,0,2600000.0,Rabat,DH,3,4,2,Bon état,142
33,Ancienne villa à côté avenue Al Melia prix choc,Souissi ,0,0,0,11000000.0,Rabat,DH,5,8,4,À rénover,2200
34,Appartement bijoux de Agdal,Agdal ,0,0,0,3200000.0,Rabat,DH,3,6,4,Bon état,175
35,Une belle villa luxueuse avec piscine et jardin à souissi,Souissi ,0,0,0,14000000.0,Rabat,DH,6,10,6,Nouveau,2100
37,Belle villa moderne à coté avenue Lalla Merieme,Souissi ,0,0,0,13000000.0,Rabat,DH,6,9,7,Nouveau,2200
38,La villa moderne de lux à hay Riad,Riyad ,0,0,0,7000000.0,Rabat,DH,3,6,3,Nouveau,338
40,Appartement à vendre à Hassan duplex loft,Quartier Administratif ,0,0,0,4200000.0,Rabat,DH,3,6,4,Bon état,330
42,Penthouse à vendre à l’Orangeraie du Souissi,Souissi ,0,0,0,7600000.0,Rabat,DH,3,4,3,Nouveau,329
44,Appartement à vendre à Hay Riad,Riyad ,0,0,0,3800000.0,Rabat,DH,3,5,3,Bon état,163
48,Vente d'un bel appartement à Prestigia,Riyad ,0,0,0,3600000.0,Rabat,DH,3,5,3,À rénover,165
49,Somptueuse villa à vendre à Riyad. 5 belles chambres. Belle terrasse et jardin,Riyad ,0,0,0,6700000.0,Rabat,DH,5,8,4,Nouveau,318
50,Appartement à vendre à agdal,Agdal ,0,0,0,1530000.0,Rabat,DH,2,3,2,Bon état,117
53,Appartement à vendre Prestigia à Riyad Surface de 168 m²,Riyad ,0,0,0,3000000.0,Rabat,DH,3,5,3,Nouveau,168
55,Superbe appartement a vendre Prestigia Hay riad,Riyad ,0,0,0,3100000.0,Rabat,DH,3,5,3,Bon état,175
57,Maison de luxe à vendre à Rabat. Superficie 200. M²,Riyad ,0,0,0,4400000.0,Rabat,DH,4,8,3,Bon état,200
58,Superbe appartement à vendre à Riyad al Andalous. Superficie 176 m²,Riyad ,0,0,0,,Rabat,,3,5,3,Nouveau,176
59,Magnifique villa à vendre à Souissi. Bir kasem Surfaçe 2050 m²,Souissi ,0,0,0,,Rabat,,5,8,4,Nouveau,2050
60,Appartement à l'achat à Riyad,Riyad ,0,0,0,5000000.0,Rabat,DH,4,7,3,Nouveau,230
63,Une belle appartement en vente Haut standing ensoleillée toute la journée,Riyad ,0,0,0,,Rabat,,4,6,3,Nouveau,206
64,Magnifique villa à vendre à Rabat. Souissi,Souissi ,0,0,0,,Rabat,,6,8,4,Bon état,2000
67,Joli appartement avendre ahayriad,Riyad ,0,0,0,2300000.0,Rabat,DH,3,6,3,Bon état,144
69,Appartement avec terrasse à vendre à agdal,Agdal ,0,0,0,4000000.0,Rabat,DH,4,6,3,Bon état,240
70,Appartement a vendre a Prestigia,Riyad ,0,0,0,2600000.0,Rabat,DH,2,3,2,Nouveau,140
72,Appartement à vendre le haut agdal,Haut Agdal ,0,0,0,3300000.0,Rabat,DH,3,6,3,Bon état,181
74,Appartement en vente à Souissi Terrasse et jardin,Souissi ,0,0,0,4500000.0,Rabat,DH,3,4,3,Nouveau,205
75,À vendre appart 4p à agdal,Agdal ,0,0,0,2150000.0,Rabat,DH,3,4,2,Nouveau,126
76,Vente Appartement Rabat Souissi,Souissi ,0,0,0,4900000.0,Rabat,DH,3,5,1,Bon état,204
77,Vente Appartement Rabat Hay Riad Prestigia,Riyad ,0,0,0,3100000.0,Rabat,DH,3,6,1,Bon état,181
78,Vente Appartement Rabat Agdal,Agdal ,0,0,0,2500000.0,Rabat,DH,3,5,1,Bon état,171
81,Vente Appartement Rabat Bas Agdal,Agdal ,0,0,0,850000.0,Rabat,DH,1,2,1,Bon état,34
82,Tres joli rez de jardin a saisir a prix imbattable,Riyad ,0,0,0,4100000.0,Rabat,DH,4,3,4,Bon état,260
83,Magnifique villa au coeur du Souissi,Souissi ,0,0,0,14500000.0,Rabat,DH,6,9,5,Bon état,2090
85,Vente villa sur une grande avenue à Hay Riad,Riyad ,0,0,0,8500000.0,Rabat,DH,4,7,4,Bon état,620
86,"Coquette villa à vendre à Riyad. 2 fac, 4 chambres. Habitable de suite, prix à saisir. De 695u",Riyad ,0,0,0,6950000.0,Rabat,DH,4,7,3,Nouveau,318
91,Une belle appartement en vente Haut standing ensoleillée toute la journée,Riyad ,0,0,0,,Rabat,,4,6,3,Nouveau,206
92,Magnifique villa à vendre à Rabat. Souissi,Souissi ,0,0,0,,Rabat,,6,8,4,Bon état,2000
94,Vente villa de luxe à Hay Riyad,Riyad ,0,0,0,5700000.0,Rabat,DH,5,8,4,Nouveau,215
95,Maison de luxe à vendre àhayriad 950m,Riyad ,0,0,0,8000000.0,Rabat,DH,5,7,4,Bon état,950
98,Appartement à vendre sur hayriad proche mahj riad,Riyad ,0,0,0,,Rabat,,3,4,2,Bon état,123
99,Vente Appartement Rabat Souissi Orangeraie,Souissi ,0,0,0,4000000.0,Rabat,DH,3,5,1,Bon état,145
100,Vente Appartement Rabat Hay Riad Prestigia,Riyad ,0,0,0,2650000.0,Rabat,DH,2,4,1,Bon état,183
106,Vente Appartement Rabat Hay Riad Prestigia,Riyad ,0,0,0,3700000.0,Rabat,DH,3,6,1,Bon état,189
107,À vendre Appartement,Agdal ,0,0,0,2000000.0,Rabat,DH,2,4,2,Bon état,103
108,Vente d'un bel appartement à Riyad. 3 chambres agréables. Ascenseur et stationnement,Riyad ,0,0,0,3700000.0,Rabat,DH,3,4,2,Bon état,190
109,"Appartement en vente à Riyad. Surface de 130 m². Résidence avec concierge, climatisation générale",Riyad ,0,0,0,2450000.0,Rabat,DH,1,3,2,Bon état,130
110,Vente App 3ch à Prestigia Hay Riad,Riyad ,0,0,0,3100000.0,Rabat,DH,3,4,3,Nouveau,170
111,Appartement à l'achat à Riyad. 7 pièces confortables. Ascenseur et terrasse,Riyad ,0,0,0,4200000.0,Rabat,DH,4,7,3,Nouveau,250
112,Appartement en vente,Rabat,0,0,0,1200000.0,Rabat,DH,1,2,1,Bon état,38
113,App 137m2 à l’Orangeraie Souissi,Souissi ,0,0,0,2900000.0,Rabat,DH,2,3,3,Nouveau,137
114,Appart 4p neuf en haut agdal,Agdal ,0,0,0,3700000.0,Rabat,DH,3,4,3,Nouveau,235
115,Appartement de 102m² à rabat hassan,Hassan - Centre Ville ,0,0,0,1480000.0,Rabat,DH,2,3,2,Nouveau,102
116,Appartement à vendre,Riyad Extension ,0,0,0,2400000.0,Rabat,DH,3,4,2,Bon état,113
117,Appartement à vendre à l’Agdal,Agdal ,0,0,0,,Rabat,,4,6,2,Bon état,196
118,Appartement à vendre,Agdal ,0,0,0,3600000.0,Rabat,DH,3,6,2,Bon état,192
120,Maison au quartie G5,Hay Al Amal ,0,0,0,1900000.0,Rabat,DH,7,10,4,À rénover,240
121,Appartement bijoux à prestigia Hay riad,Riyad ,0,0,0,3300000.0,Rabat,DH,3,6,3,Nouveau,168
122,Un très joli appartement au secteur 17,Riyad ,0,0,0,2800000.0,Rabat,DH,4,5,3,Bon état,166
123,Bel appartement au sect 17 à cote la grialladiere,Riyad ,0,0,0,3200000.0,Rabat,DH,3,7,3,Bon état,180
125,Joli appartement secteur 23,Riyad ,0,0,0,2670000.0,Rabat,DH,3,6,4,Nouveau,142
126,Appartement moderne à prestigia,Riyad ,0,0,0,3100000.0,Rabat,DH,3,6,4,Nouveau,167
127,Appartement au RDC prestigia,Riyad ,0,0,0,2350000.0,Rabat,DH,3,6,4,Nouveau,109
128,Coquette appartement avec piscine prestigia,Riyad ,0,0,0,3500000.0,Rabat,DH,3,6,4,Nouveau,174
129,Un très bel appartement à guich oudaya,Guich Oudaya ,0,0,0,1500000.0,Rabat,DH,3,4,2,Nouveau,115
130,Une villa luxueuse à Hay Nahda,Hay Nahda ,0,0,0,5100000.0,Rabat,DH,6,10,4,Bon état,560
131,Bel Appartement Meublé en Vente à Hay Nahda Rabat,Hay Nahda ,0,0,0,2272500.0,Rabat,DH,2,3,1,Bon état,101
132,Vente Penthouse Rabat Souissi Orangeraie,Souissi ,0,0,0,8000000.0,Rabat,DH,4,7,1,Bon état,370
133,Magnifique appartement à vendre à Mahaj Riad,Riyad ,0,0,0,5500000.0,Rabat,DH,3,6,3,Bon état,243
136,Vente villa de luxe à Souissi,Souissi ,0,0,0,15000000.0,Rabat,DH,5,9,4,Nouveau,2000
137,Sublime villa à Vendre Hay Riad,Riyad ,0,0,0,6850000.0,Rabat,DH,4,6,2,Nouveau,318
138,Appartement à vendre,Riyad ,0,0,0,2650000.0,Rabat,DH,3,5,2,Bon état,145
140,Joli Appartement en Vente à Fadeza Rabat,Hay Nahda ,0,0,0,620000.0,Rabat,DH,2,3,1,Bon état,85
142,Vente superbe villa à Souissi,Souissi ,0,0,0,22000000.0,Rabat,DH,4,9,6,Bon état,2000
145,Vente villa exceptionnelle à Souissi,Souissi ,0,0,0,14000000.0,Rabat,DH,5,13,8,Nouveau,933
147,Magnifique villa à vendre à Hassan,Hassan - Centre Ville ,0,0,0,12000000.0,Rabat,DH,4,9,3,Bon état,463
148,Jolie villa à vendre à Souissi,Souissi ,0,0,0,13000000.0,Rabat,DH,4,7,6,Bon état,1900
149,Appartement à vendre à Hay Riad,Riyad ,0,0,0,2600000.0,Rabat,DH,3,4,3,Bon état,130
152,Appartement à vendre à Hay Riad,Riyad ,0,0,0,4800000.0,Rabat,DH,4,5,2,Bon état,237
153,Appartement à vendre à Hay Riad,Riyad ,0,0,0,3400000.0,Rabat,DH,3,5,3,Bon état,152
154,Les deux appartements à vendre à Hay Al Riyadh,Riyad ,0,0,0,2250000.0,Rabat,DH,3,5,3,À rénover,150
155,Vend appartement à Agdal. Superficie 144 m²,Agdal ,0,0,0,2180000.0,Rabat,DH,3,5,2,Bon état,144
157,Appartement à vendre à agdal,Agdal ,0,0,0,2500000.0,Rabat,DH,2,3,2,Bon état,120
158,Appartement a vendre a agdal,Agdal ,0,0,0,1350000.0,Rabat,DH,1,2,2,Nouveau,51
159,Duplex à vendre à prestigia hay riad,Riyad ,0,0,0,4000000.0,Rabat,DH,3,5,3,Bon état,214
160,Appartement à vendre à Agdal. 3 chambres agréables. Ascenseur et stationnement,Agdal ,0,0,0,2000000.0,Rabat,DH,3,4,2,Nouveau,105
162,Appartement en vente à Agdal. 3 chambres. Places de parking et beau jardin,Agdal ,0,0,1,4700000.0,Rabat,DH,3,5,3,Nouveau,256
163,Luxueux appartement en vente sur le haut agdal,Haut Agdal ,0,0,0,3400000.0,Rabat,DH,3,5,3,Bon état,187
164,Un Joli Appartement à vendre sur Agdal,Agdal ,0,0,0,1800000.0,Rabat,DH,2,3,1,Bon état,77
165,Appartement à vendre,Diour Jamaa ,0,0,0,1760000.0,Rabat,DH,3,5,2,Nouveau,147
166,Appartement à vendre,Haut Agdal ,0,0,0,2550000.0,Rabat,DH,4,6,2,Bon état,174
167,Appartement à vendre,Riyad ,0,0,0,3200000.0,Rabat,DH,3,5,2,Nouveau,156
168,Appartement à vendre,Riyad ,0,0,0,3400000.0,Rabat,DH,3,5,3,Nouveau,153
169,A vendre villa d excellence neuve sur l'Orangeraie,Souissi ,0,0,0,13000000.0,Rabat,DH,6,12,7,Nouveau,800
170,Bel appartement avec terrasse sur Hay riad,Riyad ,0,0,0,2700000.0,Rabat,DH,3,5,2,Bon état,140
171,Un magnifique Appartement à vendre sur Hassan,Hassan - Centre Ville ,0,0,0,1050000.0,Rabat,DH,1,2,1,Bon état,70
172,Appartement bien situé à vendre,Riyad ,0,0,0,2500000.0,Rabat,DH,3,5,2,Bon état,130
173,Appartement à vendre de 127m² sur Agdal,Agdal ,0,0,0,2200000.0,Rabat,DH,3,5,2,Bon état,127
174,Appartement avec belle cour bien situé à Agdal,Haut Agdal ,0,0,0,2200000.0,Rabat,DH,3,4,2,Bon état,145
175,"Appartement de 75m² avec terrasse en vente, Résidence Aicha",Kébibat ,0,0,0,,Rabat,,2,3,2,Bon état,75
176,Un Bel Appartement à vendre sur Hassan,Diour Jamaa ,0,0,0,1400000.0,Rabat,DH,2,3,1,Bon état,95
177,Vente d'un bel appartement à Hay Al Massira. 2 pièces confortables,Hay Al Massira ,0,0,0,,Rabat,,1,2,1,Nouveau,84
178,Joli duplex à Vendre Sur Hay Riad,Riyad ,0,0,0,2600000.0,Rabat,DH,3,5,2,Bon état,141
179,Très bel appartement à vendre à Hassan,Hassan - Centre Ville ,0,0,0,1050000.0,Rabat,DH,1,2,1,Nouveau,43
180,Bel appartement à vendre en Hassan Centre Ville. Superficie 96 m². Fenêtres avec double vitrage et porte blindée,Hassan - Centre Ville ,0,0,0,1700000.0,Rabat,DH,2,3,2,Bon état,96
181,"Vente villa de luxe à Souissi. Surface de 2000 m². Salon Marocain, sécurité.",Souissi ,0,0,0,,Rabat,,7,10,5,Bon état,2000
182,Joli Appartement de trois pièces à vendre,Hay Al Fath ,0,0,0,640000.0,Rabat,DH,2,3,1,Bon état,60
184,Appartement de 3 chambres à hay El fath,Hay Al Fath ,0,0,0,1650000.0,Rabat,DH,3,4,2,Bon état,115
185,Luxueux Appartement en vente sur le haut agdal,Haut Agdal ,0,0,0,4300000.0,Rabat,DH,3,6,3,Nouveau,202
186,Bel appartement à vendre à Agdal. Superficie 86 m²,Agdal ,0,0,0,1400000.0,Rabat,DH,1,3,2,Bon état,86
187,Vend appartement à Agdal. 4 pièces confortables,Agdal ,0,0,0,2000000.0,Rabat,DH,2,4,2,Bon état,137
188,Appartement à vendre à Agdal. 4 pièces confortables,Agdal ,0,0,0,2700000.0,Rabat,DH,3,4,2,Bon état,228
189,Bel appartement à vendre à Aviation Mabella. 5 pièces confortables. Ascenseur et stationnement,Aviation - Mabella ,0,0,1,2050000.0,Rabat,DH,3,5,3,Bon état,127
190,Studio à vendre,Hassan - Centre Ville ,0,0,0,970000.0,Rabat,DH,1,1,1,Nouveau,45
191,Bel appartement à vendre à Agdal. 3 belles chambres. Parking et terrasse,Agdal ,0,0,0,2700000.0,Rabat,DH,3,7,2,Bon état,180
192,Appartement en vente à Agdal. 2 chambres,Agdal ,0,0,0,1050000.0,Rabat,DH,2,3,2,À rénover,87
193,Bel appartement sur Av Hassan 2 Res oum kelthom,Agdal ,0,0,0,1850000.0,Rabat,DH,3,6,2,Bon état,170
194,Appartement bien situé à vendre avec terrasse,Rabat,0,0,0,3500000.0,Rabat,DH,3,4,2,Bon état,207
195,Appartement à vendre sur Prestigia Hay riad residence sécurisé avec piscine,Riyad ,0,0,0,1950000.0,Rabat,DH,2,3,2,À rénover,100
196,Somptueuse maison à vendre à Riyad,Riyad ,0,0,0,,Rabat,,5,7,3,Nouveau,470
197,Avendre appartement à mahjriad,Riyad ,1,0,0,1900000.0,Rabat,DH,2,3,2,Bon état,100
198,Appart Affaire à ne pas rater derriere la douane,Riyad ,0,0,0,2100000.0,Rabat,DH,3,6,3,À rénover,135
199,Appartement à l'achat à Riyad. 5 pièces,Riyad ,1,0,0,,Rabat,,3,5,3,Nouveau,176
204,Appartement à l'achat à Riyad. 5 pièces,Riyad ,0,0,0,,Rabat,,3,5,2,Bon état,150
205,Appartement en vente,Souissi ,0,0,0,5400000.0,Rabat,DH,3,4,2,Bon état,230
206,Appartement en vente,Rabat,0,0,0,2350000.0,Rabat,DH,2,3,1,Bon état,90
207,Charmant appartement à vendre,Kébibat ,0,0,0,980000.0,Rabat,DH,2,3,2,Bon état,85
208,Appartement de 97 m² à Rabat Square,Souissi ,0,0,0,2439000.0,Rabat,DH,1,1,2,Nouveau,97
209,Appartement en vente sur Prestigia Hay Riad,Riyad ,0,0,0,3000000.0,Rabat,DH,3,4,3,Bon état,166
210,Appartement en vente sur Hay RIad,Riyad ,0,0,0,4000000.0,Rabat,DH,3,6,3,Nouveau,216
213,Vente Appartement Rabat Souissi,Souissi ,0,0,0,5600000.0,Rabat,DH,3,6,2,Bon état,230
215,Vente Riad Rabat Médina Centre Ville,Hassan - Centre Ville ,0,0,0,6700000.0,Rabat,DH,9,7,7,Bon état,244
216,Vente Appartement Rabat Hay Riad Prestigia,Riyad ,0,0,0,4000000.0,Rabat,DH,3,7,1,Bon état,209
217,Vente Appartement Rabat Agdal,Agdal ,0,0,0,1550000.0,Rabat,DH,2,4,1,Bon état,97
218,Vente Appartement Rabat Hay Riad,Riyad ,0,0,0,2669000.0,Rabat,DH,3,3,1,Bon état,142
219,Vente Appartement Rabat Hay Riad,Riyad ,0,0,0,4250000.0,Rabat,DH,3,8,1,Bon état,218
222,Vente Appartement Rabat Hay Riad Prestigia,Riyad ,0,0,0,2800000.0,Rabat,DH,3,6,1,Bon état,163
223,Vente Appartement Neuf Rabat Hay Riad,Riyad ,0,0,0,2666000.0,Rabat,DH,3,4,1,Bon état,124
224,Vente Appartement Rabat Hay Riad Prestigia,Riyad ,0,0,0,3150000.0,Rabat,DH,3,5,1,Bon état,169
225,Vente Appartement Rabat Agdal,Haut Agdal ,0,0,0,3350000.0,Rabat,DH,3,6,1,Bon état,200
226,Vente Appartement Rabat Hay Riad,Riyad ,0,0,0,4500000.0,Rabat,DH,3,6,1,Bon état,207
228,Vente Appartement Rabat Hay Riad,Riyad ,0,0,0,3500000.0,Rabat,DH,3,6,1,Bon état,179
229,Vente Appartement Rabat Agdal,Agdal ,0,0,0,3000000.0,Rabat,DH,4,7,1,Bon état,166
230,Vente Appartement Rabat Bas Agdal,Agdal ,0,0,0,4500000.0,Rabat,DH,5,9,1,Bon état,329
231,Vente Appartement Rabat Agdal,Agdal ,0,0,0,1200000.0,Rabat,DH,3,4,1,Bon état,76
232,Vente Appartement Rabat Agdal,Agdal ,0,0,0,2500000.0,Rabat,DH,3,5,1,Bon état,175
233,Vente Appartement Rabat Hay Riad,Riyad ,0,0,0,2900000.0,Rabat,DH,3,7,1,Bon état,167
235,Vente Appartement Rabat Agdal,Agdal ,0,0,0,2900000.0,Rabat,DH,3,9,1,Bon état,160
238,Vente Appartement Rabat Agdal,Agdal ,0,0,0,2100000.0,Rabat,DH,2,5,1,Bon état,129
239,Vente Appartement Rabat Hay Riad,Riyad ,0,0,0,2700000.0,Rabat,DH,4,6,2,Bon état,127
240,Vente Appartement Rabat Hay Riad,Riyad ,0,0,0,2300000.0,Rabat,DH,3,4,1,Bon état,125
241,Vente Appartement Rabat Haut Agdal,Haut Agdal ,0,0,0,2200000.0,Rabat,DH,3,5,2,Bon état,125
243,Vente Appartement Rabat Souissi Orangeraie,Souissi ,0,0,0,4700000.0,Rabat,DH,3,6,2,Bon état,189
244,Opportunités a ne pas rater villa au prix du terrain,Souissi ,0,0,0,7600000.0,Rabat,DH,4,5,6,À rénover,2500
245,Appartement de haut standing pres de decart,Haut Agdal ,0,0,0,3000000.0,Rabat,DH,3,6,3,Bon état,160
246,Appartement de haut standing hay ryad,Riyad ,0,0,0,2500000.0,Rabat,DH,3,4,3,Bon état,134
247,Vente Palais Rabat Souissi,Souissi ,0,0,0,120000000.0,Rabat,DH,10,22,5,Bon état,2950
248,Vente Immeuble Rabat Hassan,Hassan - Centre Ville ,0,0,0,20000000.0,Rabat,DH,2,29,1,Bon état,402
249,Magnifique Appartement à vendre à Prestigia,Riyad ,0,0,0,2700000.0,Rabat,DH,3,5,2,Bon état,168
250,Appartement de luxe à vendre sans vis à vis Agdal,Agdal ,0,0,0,3000000.0,Rabat,DH,3,4,2,Bon état,146
251,Appartement à Prestigia,Riyad ,0,0,0,2700000.0,Rabat,DH,3,5,3,Nouveau,154
253,Appartement de charme à Hassan,Hassan - Centre Ville ,0,0,0,2190000.0,Rabat,DH,1,3,2,Bon état,255
255,Magnifique appartement de 185 m² en plein Agdal,Agdal ,0,0,0,3100000.0,Rabat,DH,4,5,2,Bon état,180
256,STUDIO 45/m2 a vendre a prestigia hay riad,Riyad ,0,0,0,1440000.0,Rabat,DH,1,1,1,Nouveau,45
257,Beau Duplexe sur le haut Agdal pour location,Agdal ,0,0,0,1580000.0,Rabat,DH,3,4,3,Bon état,158
258,Appartement à vendre ou à louer,Agdal ,0,0,0,1200000.0,Rabat,DH,2,1,2,Bon état,74
261,Appartement 1er étage au centre ville,L'Ocean ,0,0,0,,Rabat,,2,3,1,Bon état,99
262,Appartement à vendre à rabat haut agdal,Agdal ,0,0,0,3600000.0,Rabat,DH,3,5,3,Bon état,230
263,Appartement en bon état à vendre,Akkari ,0,0,0,790000.0,Rabat,DH,2,3,1,Bon état,64
264,Appartement meublée à vendre rabat,Guich Oudaya ,0,0,0,950000.0,Rabat,DH,2,3,1,Bon état,60
265,Superbe appartement à vendre à Hay Al Kora. 2 pièces. Grande terrasse,Hay Al Kora ,0,0,0,,Rabat,,2,2,2,Bon état,94
266,Superbe Appart 103m2,Hay Nahda ,0,0,0,1850000.0,Rabat,DH,2,3,2,Nouveau,103
267,Magnifique studio meublé,Haut Agdal ,0,0,0,,Rabat,,1,1,1,Nouveau,30
268,Appartement Ensoleillé Et bien Situé,Hay El Menzah ,0,0,0,1040000.0,Rabat,DH,3,4,2,Bon état,111
269,Somptueuse villa à vendre à Souissi. 15 pièces,Souissi ,0,0,0,10000000.0,Rabat,DH,8,15,9,À rénover,2204
270,Appartement 111m²,Hay El Menzah ,0,0,0,1050000.0,Rabat,DH,3,6,1,Bon état,111
271,Appartement spacieux à préstigia,Riyad Extension ,0,0,0,4500000.0,Rabat,DH,4,6,3,Bon état,226
273,"Appartement de 134m² avec terrasse en vente, Résidence Aicha",Kébibat ,0,0,0,,Rabat,,3,4,2,Bon état,134
275,Un Bel Appartement à vendre sur Hay Riad,Riyad ,0,0,0,2600000.0,Rabat,DH,2,3,2,Bon état,125
276,Appartement Meublé à vendre sur Hay Riad,Riyad ,0,0,0,3850000.0,Rabat,DH,1,2,2,Bon état,136
277,Appartement à vendre,Agdal ,0,0,0,1600000.0,Rabat,DH,3,4,2,Bon état,97
278,Somptueuse villa à vendre à Souissi. 8 pièces. Jardin et terrasse,Souissi ,0,0,0,12000000.0,Rabat,DH,5,8,5,Bon état,2000
279,Appartement en vente à Souissi. 3 chambres agréables,Souissi ,0,0,0,4600000.0,Rabat,DH,3,5,3,Nouveau,206
280,Maison de haut standing à vendre à Souissi. Surface totale 2000 m². Cuisine entièrement équipée,Souissi ,0,0,0,13500000.0,Rabat,DH,5,9,5,Nouveau,2000
281,Appartement haut standing Prestigia Ryad,Riyad ,0,0,0,3150000.0,Rabat,DH,3,5,2,Bon état,175
282,Appartement en vente à Rabat projet al kora,Hay Al Kora ,0,0,0,540000.0,Rabat,DH,2,2,1,Bon état,60
283,Vente Appartement Rabat Océan,Rabat,0,0,0,1800000.0,Rabat,DH,3,4,2,Bon état,128
284,Vente Appartement Rabat Hay Riad,Riyad ,0,0,0,4300000.0,Rabat,DH,4,6,2,Bon état,259
285,Moderne appartement avec deux chambres sur Agdal,Agdal ,0,0,0,1750000.0,Rabat,DH,2,4,2,Bon état,109
286,Très bel appartement à l'agdal,Agdal ,0,0,0,3000000.0,Rabat,DH,3,5,2,Bon état,200
287,Appartement bien ensoleillée avec balcon,Agdal ,0,0,0,1900000.0,Rabat,DH,4,5,1,Bon état,117
288,Bel appartement neuf à vendre à Hay Riad,Riyad ,0,0,0,3450000.0,Rabat,DH,3,4,2,Nouveau,157
289,Superbe Appartement 3chambres à Prestigia Hay Riad,Riyad ,0,0,0,3300000.0,Rabat,DH,3,4,3,Bon état,157
291,Maison de haut standing à vendreou location à haroura. 4 belles chambres. Meublée,Riyad ,0,0,0,5800000.0,Rabat,DH,4,3,3,Bon état,470
292,Appartement à vendre sur Hassan Rabat,Hassan - Centre Ville ,0,0,0,1440000.0,Rabat,DH,2,3,2,Bon état,96
293,Un joli appartement à vendre sur Agdal,Agdal ,0,0,0,1250000.0,Rabat,DH,2,3,1,Bon état,86
294,Bel Appartement avec deux Terrasse sur Agdal,Agdal ,0,0,0,2000000.0,Rabat,DH,3,4,1,Bon état,123
296,Joli Appartement à vendre,Riyad ,0,0,0,2400000.0,Rabat,DH,2,3,1,Bon état,110
297,Bel appartement au cœur d'Agdal,Agdal ,0,0,0,2200000.0,Rabat,DH,3,4,1,Bon état,144
298,Appartement sur corniche à vendre,Hay Al Amal ,0,0,0,1650000.0,Rabat,DH,2,4,3,Nouveau,100
301,Maison de luxe à vendre à Souissi. Surface de 2000 m². Avec ascenseur et terrasse,Souissi ,0,0,0,,Rabat,,5,10,5,Bon état,2000
304,Superbe appartement à vendre à Agdal. Surface totale 104 m². Meublé,Agdal ,0,0,0,,Rabat,,3,4,2,Bon état,104
307,Bel appartement avec deux façades sur Agdal,Agdal ,0,0,0,1700000.0,Rabat,DH,3,4,3,Nouveau,115
308,Joli Appartement meublé Rabat Hay Riad,Riyad ,0,0,0,1680000.0,Rabat,DH,3,5,2,Bon état,120
309,Appartement bien situé à vendre bas Agdal,Agdal ,1,0,0,3232000.0,Rabat,DH,3,5,2,Bon état,202
310,Grand appartement à coté saint Exupéry,Aviation - Mabella ,0,0,0,2500000.0,Rabat,DH,3,5,2,Bon état,140
311,Appartement 100 m² en vente en plein Agdal 170M,Agdal ,0,0,0,1700000.0,Rabat,DH,2,3,1,Bon état,100
312,Luxueux Appartement a Vendre à Prestigia Hay Riad,Riyad ,0,0,0,4300000.0,Rabat,DH,4,5,3,Bon état,248
313,Bel appartement à Mahaj Riad,Rabat,0,0,0,2100000.0,Rabat,DH,2,3,1,Bon état,96
315,"Vente maison à Riyad. Superficie 200 m². Salon Marocain, sécurité",Riyad ,0,0,0,3800000.0,Rabat,DH,3,5,3,Nouveau,200
316,Appartement à l'achat à Riyad. Superficie 318 m². Belle terrasse et jardin,Riyad ,0,0,0,7000000.0,Rabat,DH,5,7,4,Nouveau,318
318,Opportunité Appart 5 min à pied Gare Rabat ville,Hassan - Centre Ville ,0,1,0,899000.0,Rabat,DH,2,4,2,Bon état,90
319,Sublime Appartement à Vendre à Hay Riad,Riyad ,0,0,0,2600000.0,Rabat,DH,2,3,2,Nouveau,123
320,Vente appartement 3ch NEUF à prestigia Hay Riad,Riyad ,0,0,0,3300000.0,Rabat,DH,3,4,3,Nouveau,145
321,Magnifique appartement 3ch à vendre à Hay Riad,Riyad ,0,0,0,4350000.0,Rabat,DH,3,6,3,Nouveau,215
322,Appartement à vendre,Riyad ,1,0,0,3600000.0,Rabat,DH,3,5,2,Bon état,212
323,Bel Appartement à vendre à Hassan,Hassan - Centre Ville ,0,0,0,1750000.0,Rabat,DH,2,3,2,Bon état,96
324,Lux résidence plein souissi,Souissi ,0,0,0,2800000.0,Rabat,DH,2,3,2,Nouveau,100
325,Luxueuse résidence en plein souissi 86.22,Souissi ,0,0,0,3700000.0,Rabat,DH,3,4,2,Nouveau,130
326,Luxueuse résidence en plein souissi,Souissi ,0,0,0,1650000.0,Rabat,DH,1,2,1,Nouveau,60
327,Vente une maison,El Youssoufia ,0,0,0,1600000.0,Rabat,DH,7,6,3,Bon état,76
328,Bel appartement à vendre à Hassan,Hassan - Centre Ville ,0,0,0,1500000.0,Rabat,DH,2,4,1,Bon état,102
329,À vendre Appartement,Diour Jamaa ,0,0,0,1700000.0,Rabat,DH,3,4,2,Bon état,170
330,Superbe appartement à vendre à Agdal. 2 pièces. Service de concierge et climatisation,Agdal ,0,0,0,,Rabat,,3,5,1,Bon état,86
331,Vend appartement à Riyad. 3 belles chambres. Bien meublé,Riyad ,1,0,0,,Rabat,,3,4,2,Bon état,80
333,À vendre Appartement,Riyad ,0,0,0,3300000.0,Rabat,DH,3,5,2,Bon état,179
339,À vendre Appartement,Agdal ,0,0,0,1580000.0,Rabat,DH,2,3,1,Bon état,72
340,À vendre Appartement,Riyad ,0,0,0,5000000.0,Rabat,DH,4,7,2,Bon état,258
341,Appartement refait à neuf en plein hay riyad,Riyad ,0,0,0,3800000.0,Rabat,DH,3,4,3,Bon état,375
342,Appartement haut standing excellent emplacement,Hay Al Fath ,0,0,0,1450000.0,Rabat,DH,2,3,2,Bon état,94
343,Vente d'un joli appartement non titré à G5,Hay Al Amal ,0,0,0,700000.0,Rabat,DH,3,4,2,Bon état,108
344,Tres bel appartement à hay riad,Riyad ,0,0,0,3300000.0,Rabat,DH,3,7,4,Nouveau,168
345,"Appartement de 115m² avec terrasse en vente, Résidence Aicha",Kébibat ,0,0,0,,Rabat,,3,4,2,Bon état,115
346,Appartement RDC sur avenue addolb habitable,Riyad ,0,0,0,2800000.0,Rabat,DH,3,6,4,Nouveau,166
348,Bel appartement à côté avenue AL ARRAR,Riyad ,0,0,0,3550000.0,Rabat,DH,3,6,3,Nouveau,175
349,Appartement à vendre à Agdal. 3 chambres agréables. Parking et terrasse,Agdal ,0,0,0,2600000.0,Rabat,DH,3,4,3,Bon état,143
350,A vendre appartement de standing à souissi,Souissi ,0,0,0,5600000.0,Rabat,DH,3,6,3,Bon état,230
